{
  "$schema": "https://json-schema.org/draft/2020-12/schema",
  "title": "TestReport",
  "description": "Output of the Test agent: an independent verdict on the exact pushed head.",
  "type": "object",
  "additionalProperties": false,
  "properties": {
    "run_id": {
      "type": "string",
      "minLength": 1
    },
    "head_sha": {
      "type": "string",
      "pattern": "^[0-9a-f]{7,40}$"
    },
    "baseline_head_sha": {
      "type": "string",
      "description": "Set when head_sha includes the Test stage's own test-only commits: the latest dev head those commits sit on.",
      "pattern": "^[0-9a-f]{7,40}$"
    },
    "implementation_review": {
      "type": "object",
      "additionalProperties": false,
      "properties": {
        "verdict": {
          "type": "string",
          "enum": ["accept", "revise"]
        },
        "scores": {
          "type": "array",
          "items": {
            "type": "object",
            "additionalProperties": false,
            "properties": {
              "criterion": {
                "type": "string",
                "minLength": 1
              },
              "score": {
                "type": "integer",
                "minimum": 0,
                "maximum": 2
              },
              "note": {
                "type": "string",
                "minLength": 1
              }
            },
            "required": ["criterion", "score", "note"]
          },
          "minItems": 1
        },
        "required_changes": {
          "type": "array",
          "items": {
            "type": "string",
            "minLength": 1
          }
        }
      },
      "required": ["verdict", "scores", "required_changes"],
      "description": "Rubric scores for the upstream artifact. Criteria ids come from policy.json rubrics.<upstream stage>. verdict must be 'revise' when any critical criterion scores 0 or the normalized total is below the rubric threshold."
    },
    "verdict": {
      "type": "string",
      "enum": ["pass", "fail"]
    },
    "criteria_results": {
      "type": "array",
      "items": {
        "type": "object",
        "additionalProperties": false,
        "properties": {
          "id": {
            "type": "string",
            "pattern": "^AC-[0-9]+$"
          },
          "status": {
            "type": "string",
            "enum": ["pass", "fail", "untested"]
          },
          "evidence": {
            "type": "string",
            "minLength": 1,
            "description": "Command and outcome, test name, or artifact path that decides the criterion."
          },
          "note": {
            "type": "string"
          }
        },
        "required": ["id", "status", "evidence", "note"]
      },
      "minItems": 1
    },
    "tests_added": {
      "type": "array",
      "items": {
        "type": "string",
        "minLength": 1
      }
    },
    "checks": {
      "type": "array",
      "items": {
        "type": "object",
        "additionalProperties": false,
        "properties": {
          "command": {
            "type": "string",
            "minLength": 1
          },
          "result": {
            "type": "string",
            "enum": ["pass", "fail", "not_run"]
          },
          "note": {
            "type": "string"
          }
        },
        "required": ["command", "result", "note"]
      },
      "minItems": 1
    },
    "findings": {
      "type": "array",
      "items": {
        "type": "object",
        "additionalProperties": false,
        "properties": {
          "severity": {
            "type": "string",
            "enum": ["blocker", "major", "minor"]
          },
          "criterion": {
            "type": "string"
          },
          "location": {
            "type": "string",
            "minLength": 1
          },
          "description": {
            "type": "string",
            "minLength": 1
          },
          "repro": {
            "type": "string",
            "minLength": 1
          }
        },
        "required": ["severity", "criterion", "location", "description", "repro"]
      }
    }
  },
  "required": [
    "run_id",
    "head_sha",
    "implementation_review",
    "verdict",
    "criteria_results",
    "tests_added",
    "checks",
    "findings"
  ]
}
